{
  "id": "timeout-zero-refused",
  "description": "A timeout of 0 is an argument error, raised by the constructor or the call before any request.",
  "client": {
    "api_key": "dn_test_conformance",
    "timeout": 0
  },
  "call": {
    "method": "decide",
    "args": {
      "state": "s",
      "questions": {
        "q": {
          "$truth": {
            "instructions": "?"
          }
        }
      }
    }
  },
  "expect": {
    "attempts": 0,
    "outcome": {
      "argument_error": true
    }
  }
}
