{
  "id": "local-count-after-question-entries",
  "description": "A choice without criteria and seventeen URL images: one ValidationError lists the question's entry first, then the images' too_long, as the API lists its 422 entries (the body's fields in order: state, questions, images, videos). Checked locally, no request.",
  "client": {
    "api_key": "dn_test_conformance"
  },
  "call": {
    "method": "decide",
    "args": {
      "state": "s",
      "images": [
        {
          "$image": {
            "id": "u0",
            "url": "https://files.example.com/0.jpg"
          }
        },
        {
          "$image": {
            "id": "u1",
            "url": "https://files.example.com/1.jpg"
          }
        },
        {
          "$image": {
            "id": "u2",
            "url": "https://files.example.com/2.jpg"
          }
        },
        {
          "$image": {
            "id": "u3",
            "url": "https://files.example.com/3.jpg"
          }
        },
        {
          "$image": {
            "id": "u4",
            "url": "https://files.example.com/4.jpg"
          }
        },
        {
          "$image": {
            "id": "u5",
            "url": "https://files.example.com/5.jpg"
          }
        },
        {
          "$image": {
            "id": "u6",
            "url": "https://files.example.com/6.jpg"
          }
        },
        {
          "$image": {
            "id": "u7",
            "url": "https://files.example.com/7.jpg"
          }
        },
        {
          "$image": {
            "id": "u8",
            "url": "https://files.example.com/8.jpg"
          }
        },
        {
          "$image": {
            "id": "u9",
            "url": "https://files.example.com/9.jpg"
          }
        },
        {
          "$image": {
            "id": "u10",
            "url": "https://files.example.com/10.jpg"
          }
        },
        {
          "$image": {
            "id": "u11",
            "url": "https://files.example.com/11.jpg"
          }
        },
        {
          "$image": {
            "id": "u12",
            "url": "https://files.example.com/12.jpg"
          }
        },
        {
          "$image": {
            "id": "u13",
            "url": "https://files.example.com/13.jpg"
          }
        },
        {
          "$image": {
            "id": "u14",
            "url": "https://files.example.com/14.jpg"
          }
        },
        {
          "$image": {
            "id": "u15",
            "url": "https://files.example.com/15.jpg"
          }
        },
        {
          "$image": {
            "id": "u16",
            "url": "https://files.example.com/16.jpg"
          }
        }
      ],
      "questions": {
        "route": {
          "type": "choice",
          "instructions": "Where?"
        }
      }
    }
  },
  "expect": {
    "attempts": 0,
    "outcome": {
      "error": "ValidationError",
      "fields": {
        "status": null,
        "error_type": null,
        "request_id": null,
        "entries": [
          {
            "type": "missing",
            "loc": [
              "body",
              "questions",
              "route",
              "choice",
              "criteria"
            ],
            "msg": "Field required",
            "input": {
              "type": "choice",
              "instructions": "Where?"
            }
          },
          {
            "type": "too_long",
            "loc": [
              "body",
              "images"
            ],
            "msg": "List should have at most 16 items after validation, not 17",
            "input": [
              {
                "id": "u0",
                "url": "https://files.example.com/0.jpg"
              },
              {
                "id": "u1",
                "url": "https://files.example.com/1.jpg"
              },
              {
                "id": "u2",
                "url": "https://files.example.com/2.jpg"
              },
              {
                "id": "u3",
                "url": "https://files.example.com/3.jpg"
              },
              {
                "id": "u4",
                "url": "https://files.example.com/4.jpg"
              },
              {
                "id": "u5",
                "url": "https://files.example.com/5.jpg"
              },
              {
                "id": "u6",
                "url": "https://files.example.com/6.jpg"
              },
              {
                "id": "u7",
                "url": "https://files.example.com/7.jpg"
              },
              {
                "id": "u8",
                "url": "https://files.example.com/8.jpg"
              },
              {
                "id": "u9",
                "url": "https://files.example.com/9.jpg"
              },
              {
                "id": "u10",
                "url": "https://files.example.com/10.jpg"
              },
              {
                "id": "u11",
                "url": "https://files.example.com/11.jpg"
              },
              {
                "id": "u12",
                "url": "https://files.example.com/12.jpg"
              },
              {
                "id": "u13",
                "url": "https://files.example.com/13.jpg"
              },
              {
                "id": "u14",
                "url": "https://files.example.com/14.jpg"
              },
              {
                "id": "u15",
                "url": "https://files.example.com/15.jpg"
              },
              {
                "id": "u16",
                "url": "https://files.example.com/16.jpg"
              }
            ],
            "ctx": {
              "field_type": "List",
              "max_length": 16,
              "actual_length": 17
            }
          }
        ]
      }
    }
  }
}
