{
  "id": "older-id-latest-accepted",
  "description": "The older id decisionnode-latest stays accepted: the SDK sends it unchanged, as model is free text, and the API answers with the pinned id of the decisionnode-moe family, decisionnode-moe-<version>.",
  "client": {
    "api_key": "dn_test_conformance"
  },
  "call": {
    "method": "decide",
    "args": {
      "state": "I was charged twice.",
      "questions": {
        "q": {
          "$truth": {
            "instructions": "Is a refund asked for?"
          }
        }
      },
      "model": "decisionnode-latest"
    }
  },
  "expect": {
    "attempts": 1,
    "request_sequence": [
      {
        "method": "POST",
        "path": "/v1/decide",
        "status": 200,
        "body_checks": [
          {
            "pointer": "/model",
            "equals": "decisionnode-latest"
          }
        ]
      }
    ],
    "outcome": {
      "result": "decision",
      "decision": {
        "model": {
          "$pattern": "^decisionnode-moe-"
        }
      }
    }
  }
}
