{
  "id": "local-collections-label-too-long",
  "description": "A label of 129 characters: a label is at most 128. Checked locally (a limit a client may hold): ValidationError with the entry the API answers, its input echoed as the API echoes it (the first 64 characters, then \"...\"); nothing is sent.",
  "client": {
    "api_key": "dn_test_conformance"
  },
  "call": {
    "method": "collections.enroll",
    "args": {
      "collection_id": "col_3f6c1a9e0b2d4c7f8a1e5d9b2c4f6a80",
      "image": {
        "$image": {
          "id": "badge",
          "url": "https://files.example.com/badges/emp-1042.jpg"
        }
      },
      "reference": "emp-1042",
      "label": "lllllllllllllllllllllllllllllllllllllllllllllllllllllllllllllllllllllllllllllllllllllllllllllllllllllllllllllllllllllllllllllllll"
    }
  },
  "expect": {
    "attempts": 0,
    "outcome": {
      "error": "ValidationError",
      "fields": {
        "status": null,
        "request_id": null,
        "entries": [
          {
            "type": "string_too_long",
            "loc": [
              "body",
              "label"
            ],
            "msg": "String should have at most 128 characters",
            "input": "llllllllllllllllllllllllllllllllllllllllllllllllllllllllllllllll...",
            "ctx": {
              "max_length": 128
            }
          }
        ]
      }
    }
  }
}
